{
    "name": "Employee",
    "controller": "tables/employee.js",
    "data": "./data/employee.json",
    "columns": [
        {
            "name": "ID",
            "type": "Integer"
        },
        {
            "name": "firstName",
            "caption": "First Name",
            "type": "Text"
        },
        {
            "name": "lastName",
            "caption": "Last Name",
            "type": "Text"
        },
        {
            "name": "dob",
            "caption": "Date of Birth",
            "type": "Date"
        },
        {
            "name": "salary",
            "caption": "Salary",
            "type": "Decimal"
        }
    ]
}